<?xml version="1.0" encoding="UTF-8"?>
<!DOCTYPE pluginRecords SYSTEM "plugininfo/plugins.dtd">
<pluginRecords>
    <plugin filename="ij.jar">
        <version>
            <checksum>774c8957fdc8938374b67fdfb58dbb8f751a4e63</checksum>
            <timestamp>20090703202454</timestamp>
            <description>ij.jar plugin

The one that allows Fiji to function.</description>
            <filesize>1193232</filesize>
            <dependency>
                <filename>jars/javac.jar</filename>
                <date>20090703202454</date>
                <relation>at-least</relation>
            </dependency>
        </version>
    </plugin>
    <plugin filename="jars/Jama-1.0.2.jar">
        <version>
            <checksum>df831d146eca8e65f887f4704e706d1c9f867e7a</checksum>
            <timestamp>20090504010022</timestamp>
            <description/>
            <filesize>32775</filesize>
        </version>
    </plugin>
    <plugin filename="jars/batik.jar">
        <version>
            <checksum>dbab80ab5e11fb33328c7da88a849d0a19793ff5</checksum>
            <timestamp>20090506010300</timestamp>
            <description>batik.jar description!!!</description>
            <filesize>8004326</filesize>
            <dependency>
                <filename>jars/jacl.jar</filename>
                <date>20090506010254</date>
                <relation>at-least</relation>
            </dependency>
            <dependency>
                <filename>jars/jython2.2.1/jython.jar</filename>
                <date>20090504010029</date>
                <relation>at-least</relation>
            </dependency>
        </version>
    </plugin>
    <plugin filename="jars/javac.jar">
        <version>
            <checksum>0528f1cd0125627b24c300472230b63ffde47607</checksum>
            <timestamp>20090703202454</timestamp>
            <description>Break the ice

T
E
S
T
I
N
G

j
a
v
a
c
.
j
a
r
!
!
!</description>
            <filesize>1041423</filesize>
        </version>
    </plugin>
    <plugin filename="plugins/AnalyzeSkeleton_.jar">
        <version>
            <checksum>3fa6016bf0155f0cb3e292e2e1211bece5ecd503</checksum>
            <timestamp>20090703202613</timestamp>
            <description>Skeleton summary...
1
2
3
4
5
6
7
8
9
0</description>
            <filesize>6698</filesize>
        </version>
    </plugin>
    <plugin filename="plugins/Plugin_Manager.jar">
        <version>
            <checksum>2c9e944e8a0a6166e832bb60da47057f796cc567</checksum>
            <timestamp>20090713162249</timestamp>
            <description>New version that is uploaded!</description>
            <filesize>97996</filesize>
            <dependency>
                <filename>jars/batik.jar</filename>
                <date>20090506010300</date>
                <relation>at-least</relation>
            </dependency>
        </version>
    </plugin>
</pluginRecords>
